{
    "CustId": 1 , 
    "CustName": "ABCD",
    "CustAddress": "NewYork",
    "ProductsList":[
        { "ProdId": 1001 , "Qty": 5 , "CustAct": "a"},
        { "ProdId": 5001 , "Qty": 3 , "CustAct": "a"},
        { "ProdId": 4001 , "Qty": 5 , "CustAct": "a"},
        { "ProdId": 1001 , "Qty": 2 , "CustAct": "r"},
        { "ProdId": 7001 , "Qty": 4 , "CustAct": "a"},
        { "ProdId": 5001 , "Qty": 5 , "CustAct": "a"},
        { "ProdId": 5001 , "Qty": 2 , "CustAct": "r"},
        { "ProdId": 7001 , "Qty": 1 , "CustAct": "r"},
        { "ProdId": 1201 , "Qty": 5 , "CustAct": "a"},
        { "ProdId": 1501 , "Qty": 3 , "CustAct": "a"},
        { "ProdId": 1801 , "Qty": 8 , "CustAct": "a"},
        { "ProdId": 1301 , "Qty": 5 , "CustAct": "a"},
        { "ProdId": 1201 , "Qty": 1 , "CustAct": "r"},
        { "ProdId": 1101 , "Qty": 5 , "CustAct": "a"},
        { "ProdId": 2001 , "Qty": 10, "CustAct": "a"},
        { "ProdId": 3001 , "Qty": 10, "CustAct": "a"},
        { "ProdId": 7001 , "Qty": 5 , "CustAct": "a"},
        { "ProdId": 2001 , "Qty": 5 , "CustAct": "r"},
        { "ProdId": 9001 , "Qty": 5 , "CustAct": "a"},
        { "ProdId": 1801 , "Qty": 10, "CustAct": "a"},
        { "ProdId": 1201 , "Qty": 3 , "CustAct": "a"},
        { "ProdId": 1601 , "Qty": 4 , "CustAct": "a"},
        { "ProdId": 5001 , "Qty": 7 , "CustAct": "a"},
        { "ProdId": 1401 , "Qty": 3 , "CustAct": "a"},
        { "ProdId": 1601 , "Qty": 1 , "CustAct": "r"},
        { "ProdId": 2001 , "Qty": 5 , "CustAct": "a"},
        { "ProdId": 2101 , "Qty": 5 , "CustAct": "a"},
        { "ProdId": 1601 , "Qty": 5 , "CustAct": "a"},
        { "ProdId": 1801 , "Qty": 3 , "CustAct": "r"},
        { "ProdId": 1101 , "Qty": 1 , "CustAct": "r"}
        ]
}